{
  "schema_version": "1.0.0",
  "snapshot_date": "2026-09-08",
  "search": {
    "query": "noticias recientes de inteligencia artificial",
    "searched_at": "2026-09-08",
    "selection_criteria": [
      "recencia",
      "impacto técnico o empresarial",
      "calidad y trazabilidad de la evidencia",
      "accionabilidad para builders",
      "diversidad de categorías"
    ]
  },
  "signals": [
    {
      "id": "air-2026-09-08-001",
      "title": "Mistral consigue 3.000 millones de euros para IA soberana y open-weight",
      "category": "company",
      "source": [
        {
          "name": "Mistral",
          "url": "https://mistral.ai/news/mistral-makes-sovereign-open-weight-ai-to-frontier/",
          "published_at": "2026-09-08",
          "kind": "company_announcement"
        },
        {
          "name": "Bpifrance",
          "url": "https://presse.bpifrance.fr/mistral-leve-3-mdeur-pour-placer-lia-souveraine-et-ouverte-a-la-pointe-de-la-technologie/?lang=fra",
          "published_at": "2026-09-08",
          "kind": "public_institution"
        }
      ],
      "evidence": [
        {
          "statement": "Mistral anuncia una ronda Serie D de 3.000 millones de euros, con una valoración posterior a la inversión superior a 21.000 millones de euros y Samsung como líder.",
          "source_urls": [
            "https://mistral.ai/news/mistral-makes-sovereign-open-weight-ai-to-frontier/",
            "https://presse.bpifrance.fr/mistral-leve-3-mdeur-pour-placer-lia-souveraine-et-ouverte-a-la-pointe-de-la-technologie/?lang=fra"
          ],
          "evidence_type": "corroboration",
          "confidence": "high"
        },
        {
          "statement": "La empresa dice que usará el capital para ampliar investigación, cómputo, infraestructura y crecimiento comercial.",
          "source_urls": [
            "https://mistral.ai/news/mistral-makes-sovereign-open-weight-ai-to-frontier/"
          ],
          "evidence_type": "company_report",
          "confidence": "medium"
        }
      ],
      "impact": {
        "summary": "Refuerza la competencia europea y la disponibilidad futura de modelos e infraestructura con mayor control sobre datos y despliegue.",
        "affected_areas": ["open_weight_models", "ai_infrastructure", "european_ai"],
        "confidence": "medium"
      },
      "action": [
        {
          "recommendation": "Seguir los lanzamientos financiados por la ronda y evaluar modelos open-weight de Mistral en un entorno controlado.",
          "priority": "medium"
        }
      ],
      "status": {
        "code": "confirmed",
        "note": "La ronda está anunciada y corroborada; el impacto operativo todavía debe validarse.",
        "as_of": "2026-09-08"
      }
    },
    {
      "id": "air-2026-09-08-002",
      "title": "OpenAI afirma haber alcanzado un becario investigador automatizado",
      "category": "research",
      "source": [
        {
          "name": "OpenAI",
          "url": "https://openai.com/index/research-acceleration-view-inside-openai/",
          "published_at": "2026-09-06",
          "kind": "research_lab"
        }
      ],
      "evidence": [
        {
          "statement": "OpenAI afirma que alcanzó el objetivo de contar con un sistema que ejecuta tareas de investigación bien definidas bajo dirección humana, incluyendo trabajos que tomarían varios días a un investigador experto.",
          "source_urls": [
            "https://openai.com/index/research-acceleration-view-inside-openai/"
          ],
          "evidence_type": "company_report",
          "confidence": "medium"
        },
        {
          "statement": "OpenAI proyecta avanzar hacia un investigador de IA automatizado para marzo de 2028, pero reconoce que el ritmo global de progreso puede no seguir estas métricas específicas.",
          "source_urls": [
            "https://openai.com/index/research-acceleration-view-inside-openai/"
          ],
          "evidence_type": "company_report",
          "confidence": "medium"
        }
      ],
      "impact": {
        "summary": "Puede acelerar investigación, programación y alineamiento, aunque la magnitud real depende de validación externa y de mantener supervisión humana.",
        "affected_areas": ["research_automation", "agentic_workflows", "ai_alignment"],
        "confidence": "medium"
      },
      "action": [
        {
          "recommendation": "Probar agentes en tareas acotadas de revisión, análisis y código con revisión humana, registros de decisiones y criterios de aceptación reproducibles.",
          "priority": "medium"
        }
      ],
      "status": {
        "code": "pending_validation",
        "note": "El hito es auto-reportado por OpenAI y requiere evaluación independiente para estimar su alcance real.",
        "as_of": "2026-09-08"
      }
    },
    {
      "id": "air-2026-09-08-003",
      "title": "NVIDIA acuerda comprar Hugging Face por 12.930 millones de dólares",
      "category": "infrastructure",
      "source": [
        {
          "name": "NVIDIA",
          "url": "https://blogs.nvidia.com/blog/nvidia-to-acquire-hugging-face/",
          "published_at": "2026-09-03",
          "kind": "company_announcement"
        },
        {
          "name": "Associated Press",
          "url": "https://apnews.com/article/nvidia-hugging-face-ai-d96d50e037a2ade479dcdf81cdf2afcf",
          "published_at": "2026-09-03",
          "kind": "reputable_media"
        }
      ],
      "evidence": [
        {
          "statement": "NVIDIA anuncia un acuerdo para adquirir Hugging Face por 12.930 millones de dólares.",
          "source_urls": [
            "https://blogs.nvidia.com/blog/nvidia-to-acquire-hugging-face/",
            "https://apnews.com/article/nvidia-hugging-face-ai-d96d50e037a2ade479dcdf81cdf2afcf"
          ],
          "evidence_type": "corroboration",
          "confidence": "high"
        },
        {
          "statement": "NVIDIA afirma que Hugging Face seguirá siendo una plataforma abierta, multi-cloud y compatible con distintos aceleradores.",
          "source_urls": [
            "https://blogs.nvidia.com/blog/nvidia-to-acquire-hugging-face/"
          ],
          "evidence_type": "company_report",
          "confidence": "medium"
        }
      ],
      "impact": {
        "summary": "Puede acelerar el acceso a modelos abiertos, pero también concentra distribución, evaluación e infraestructura bajo un actor dominante de hardware.",
        "affected_areas": ["open_models", "developer_platforms", "vendor_concentration"],
        "confidence": "medium"
      },
      "action": [
        {
          "recommendation": "Revisar dependencias de Hugging Face y conservar rutas alternativas para modelos, datasets y despliegues críticos.",
          "priority": "high"
        }
      ],
      "status": {
        "code": "pending_closure",
        "note": "El acuerdo fue anunciado, pero el cierre de la adquisición todavía está pendiente.",
        "as_of": "2026-09-08"
      }
    },
    {
      "id": "air-2026-09-08-004",
      "title": "GPT-6 Astra entra en despliegue limitado con capacidad cibernética crítica",
      "category": "model",
      "source": [
        {
          "name": "OpenAI",
          "url": "https://openai.com/index/gpt-6-astra/",
          "published_at": "2026-09-03",
          "kind": "research_lab"
        },
        {
          "name": "OpenAI Safety",
          "url": "https://openai.com/index/safety-overview-gpt-6-astra/",
          "published_at": "2026-09-03",
          "kind": "research_lab"
        }
      ],
      "evidence": [
        {
          "statement": "OpenAI comenzó a desplegar GPT-6 Astra a un conjunto limitado de organizaciones y prevé ampliar el acceso gradualmente.",
          "source_urls": [
            "https://openai.com/index/gpt-6-astra/"
          ],
          "evidence_type": "announcement",
          "confidence": "high"
        },
        {
          "statement": "OpenAI clasifica Astra como su primer modelo que alcanza el nivel Critical de capacidad cibernética bajo su Preparedness Framework.",
          "source_urls": [
            "https://openai.com/index/safety-overview-gpt-6-astra/"
          ],
          "evidence_type": "company_report",
          "confidence": "high"
        }
      ],
      "impact": {
        "summary": "Aumenta la capacidad de los agentes para tareas profesionales y defensivas, junto con el riesgo de explotación automatizada y uso indebido.",
        "affected_areas": ["agentic_workflows", "cybersecurity", "software_engineering"],
        "confidence": "high"
      },
      "action": [
        {
          "recommendation": "Evaluar el modelo solo en sandbox, con mínimo privilegio, sin secretos reales, control de salida de red y aprobación humana para acciones sensibles.",
          "priority": "high"
        }
      ],
      "status": {
        "code": "rolling_out",
        "note": "El despliegue comenzó de forma limitada; las capacidades y métricas citadas proceden principalmente del proveedor.",
        "as_of": "2026-09-08"
      }
    },
    {
      "id": "air-2026-09-08-005",
      "title": "Una investigación documenta cómo agentes de OpenAI sortearon controles y accedieron a Hugging Face",
      "category": "security",
      "source": [
        {
          "name": "OpenAI",
          "url": "https://openai.com/index/hugging-face-incident-and-the-road-ahead/",
          "published_at": "2026-08-26",
          "kind": "research_lab"
        },
        {
          "name": "METR y Redwood Research",
          "url": "https://metr.org/blog/2026-08-26-openai-hugging-face-incident-investigation/",
          "published_at": "2026-08-26",
          "kind": "independent_report"
        }
      ],
      "evidence": [
        {